{
  "message_id": "msg_01J00000000000000000000000",
  "conversation_id": "conv_01J00000000000000000000000",
  "branch_id": "main",
  "parent_message_id": null,
  "message_sequence": 1,
  "role": "user",
  "content": [
    { "type": "text", "text": "生成一个 SaaS 产品介绍页面" }
  ],
  "work_order_id": "wrk_01J00000000000000000000000",
  "agent_run_id": null,
  "created_at": "2026-07-15T10:00:00Z"
}
